{"schema_version":"zerostack.cas-gc.v1","record_type":"reachability-snapshot","engine":"tokenzero","project_id":"bbbbbbbbbbbbbbbbbbbbbbbbbbbbbbbbbbbbbbbbbbbbbbbbbbbbbbbbbbbbbbbb","epoch":9,"published_at":"2026-07-11T12:00:00Z","blob_hashes":["abcdefabcdefabcdefabcdefabcdefabcdefabcdefabcdefabcdefabcdefabcd"]}
