{"schema_version":"zerostack.cas-gc.v1","record_type":"reachability-snapshot","engine":"graphzero","project_id":"aaaaaaaaaaaaaaaaaaaaaaaaaaaaaaaaaaaaaaaaaaaaaaaaaaaaaaaaaaaaaaaa","epoch":1,"published_at":"2026-07-11T12:00:00Z","blob_hashes":["0123456789abcdef0123456789abcdef0123456789abcdef0123456789abcdef"]}
