{"schema_version":"zerostack.cas-gc.v1","record_type":"reachability-snapshot","engine":"fszero","project_id":"aaaaaaaaaaaaaaaaaaaaaaaaaaaaaaaaaaaaaaaaaaaaaaaaaaaaaaaaaaaaaaaa","epoch":13,"published_at":"2026-07-11T12:00:00Z","blob_hashes":["abcdefabcdefabcdefabcdefabcdefabcdefabcdefabcdefabcdefabcdefabcd"]}
